{
  "prd_artifact": {
    "artifact_id": "prd-help-center-search",
    "version": "0.1.0",
    "previous_version": null,
    "phase": "CORE",
    "structured_sections": ["background", "problem", "goal", "non-goals", "target-users", "scope", "core-flow", "confirmed-decisions"],
    "markdown_ref": "repo://context-workspace/workspace/prd/help-center-search.md",
    "content_ref": "repo://case-data/help-center-search/prd/candidates/help-center-search.core.md",
    "source_refs": [
      "repo://context-workspace/context/product/search-current-state.md",
      "repo://context-workspace/context/product/search-solution.md",
      "repo://context-workspace/context/business-rules/search-boundaries.md",
      "repo://context-workspace/drafts/help-center-search/用户反馈汇总.md"
    ],
    "decision_refs": ["decision_solution", "decision_boundary", "decision_owner", "decision_validation"]
  },
  "coverage": {
    "required_sections": ["background", "problem", "goal", "non-goals", "target-users", "scope", "core-flow", "confirmed-decisions"],
    "covered_sections": ["background", "problem", "goal", "non-goals", "target-users", "scope", "core-flow", "confirmed-decisions"],
    "missing_sections": []
  },
  "unresolved_items": [{"item": "典型查询集具体条目和维护时间", "status": "OPEN", "source_refs": ["repo://case-data/help-center-search/prd/decision-ledger.confirmed.json"]}],
  "unsupported_claims": [],
  "change_summary": "首次生成 PRD 主体"
}
