{
  "prd_artifact": {
    "artifact_id": "prd-product-work",
    "version": "0.1.0",
    "previous_version": null,
    "phase": "CORE",
    "structured_sections": ["background", "problem", "goal", "non-goals", "target-users", "scope", "core-flow", "confirmed-decisions"],
    "markdown_ref": "repo://context-workspace/workspace/prd/product-work.md",
    "content_ref": "repo://evaluation/fixtures/prd/candidates/product-work.core.md",
    "source_refs": [
      "repo://context-workspace/context/product-work/product/current-state.md",
      "repo://context-workspace/context/product-work/product/solution.md",
      "repo://context-workspace/context/product-work/business-rules/boundary.md",
      "repo://context-workspace/drafts/product-work/用户反馈.md"
    ],
    "decision_refs": ["decision_solution", "decision_boundary", "decision_owner", "decision_validation"]
  },
  "coverage": {
    "required_sections": ["background", "problem", "goal", "non-goals", "target-users", "scope", "core-flow", "confirmed-decisions"],
    "covered_sections": ["background", "problem", "goal", "non-goals", "target-users", "scope", "core-flow", "confirmed-decisions"],
    "missing_sections": []
  },
  "unresolved_items": [{"item": "典型查询集具体条目和维护时间", "status": "OPEN", "source_refs": ["repo://evaluation/fixtures/prd/decision-ledger.confirmed.json"]}],
  "unsupported_claims": [],
  "change_summary": "首次生成 PRD 主体"
}
