{
  "prd_artifact": {
    "artifact_id": "prd-example-project",
    "version": "0.1.0",
    "previous_version": null,
    "phase": "CORE",
    "structured_sections": ["background", "goal", "scope", "core-flow"],
    "markdown_ref": "repo://context-workspace/workspace/prd/example-project.md",
    "content_ref": "repo://runtime/provider-output/example-project/prd.core.md",
    "source_refs": ["repo://context-workspace/context/example-project/product/current-state.md"],
    "decision_refs": ["decision_owner"]
  },
  "coverage": {"required_sections": ["background", "goal", "scope", "core-flow"], "covered_sections": ["background", "goal", "scope", "core-flow"], "missing_sections": []},
  "unresolved_items": [],
  "unsupported_claims": [],
  "change_summary": "首次生成 PRD 主体"
}
