{
  "prd_artifact": {
    "artifact_id": "prd-help-center-search",
    "version": "0.2.0",
    "previous_version": "0.1.0",
    "phase": "DETAILS",
    "structured_sections": ["background", "problem", "goal", "non-goals", "target-users", "scope", "core-flow", "confirmed-decisions", "functional-rules", "roles-permissions", "boundaries-exceptions", "dependencies-validation", "acceptance", "release-todos"],
    "markdown_ref": "repo://context-workspace/workspace/prd/help-center-search.md",
    "content_ref": "repo://case-data/help-center-search/prd/candidates/help-center-search.details.md",
    "source_refs": [
      "repo://context-workspace/context/product/search-current-state.md",
      "repo://context-workspace/context/product/search-solution.md",
      "repo://context-workspace/context/business-rules/search-boundaries.md",
      "repo://context-workspace/drafts/help-center-search/用户反馈汇总.md",
      "repo://case-data/help-center-search/prd/decision-ledger.confirmed.json"
    ],
    "decision_refs": ["decision_solution", "decision_boundary", "decision_owner", "decision_validation"]
  },
  "coverage": {
    "required_sections": ["background", "problem", "goal", "non-goals", "target-users", "scope", "core-flow", "confirmed-decisions", "functional-rules", "roles-permissions", "boundaries-exceptions", "dependencies-validation", "acceptance", "release-todos"],
    "covered_sections": ["background", "problem", "goal", "non-goals", "target-users", "scope", "core-flow", "confirmed-decisions", "functional-rules", "roles-permissions", "boundaries-exceptions", "dependencies-validation", "acceptance", "release-todos"],
    "missing_sections": []
  },
  "unresolved_items": [
    {"item": "别名冲突和一词多目标规则", "status": "OPEN"},
    {"item": "目标内容不可用时的提示文案", "status": "OPEN"}
  ],
  "unsupported_claims": [],
  "change_summary": "在已确认主体基础上补充功能规则、权限、边界、验收和发布前待办"
}
