{
  "prd_artifact": {
    "artifact_id": "prd-product-work",
    "version": "0.2.1",
    "previous_version": "0.2.0",
    "phase": "DETAILS",
    "structured_sections": ["功能规则", "角色与权限", "边界与异常", "依赖与效果验证", "验收标准", "发布前待办"],
    "markdown_ref": "repo://context-workspace/workspace/prd/product-work.md",
    "content_ref": "repo://evaluation/fixtures/change/candidates/product-work.revision-details.md",
    "source_refs": [
      "repo://context-workspace/workspace/reports/change-impact.json",
      "repo://context-workspace/workspace/plans/product-work-replan.json",
      "repo://context-workspace/workspace/prd/product-work.md"
    ],
    "decision_refs": ["decision_solution", "decision_boundary", "decision_owner", "decision_validation"]
  },
  "coverage": {
    "required_sections": ["功能规则", "角色与权限", "边界与异常", "依赖与效果验证", "验收标准", "发布前待办"],
    "covered_sections": ["功能规则", "角色与权限", "边界与异常", "依赖与效果验证", "验收标准", "发布前待办"],
    "missing_sections": []
  },
  "unresolved_items": ["现有内容系统是否提供内容项下线和标签删除事件"],
  "unsupported_claims": [],
  "change_summary": "仅补充目标内容失效后的自动停用、提示、审核、重新启用和验收规则"
}
